{
  "eventId": "50000000-0000-7000-8000-000000000001",
  "workspaceId": "10000000-0000-7000-8000-000000000001",
  "aggregateId": "40000000-0000-7000-8000-000000000001",
  "sequence": 8,
  "type": "DRAFT_CHANGED",
  "version": 1,
  "occurredAt": "2026-01-15T09:00:00Z",
  "correlationId": "corr-fixture-0001",
  "payload": {
    "documentId": "40000000-0000-7000-8000-000000000001",
    "draftId": "60000000-0000-7000-8000-000000000001",
    "revision": 8,
    "operationIds": ["30000000-0000-7000-8000-000000000001"]
  }
}
